{
  "schema_version": 3,
  "versions": {
    "schema": "3",
    "state": "s1",
    "frame": "f1",
    "ontology": "o1",
    "isa": "i1",
    "world": "w1",
    "task": "t1",
    "evidence": "e1"
  },
  "capsule_id": "bound",
  "document_id": "bound",
  "version": "bound",
  "observations": [],
  "allowed_query_family": [],
  "evidence_handles": [],
  "dependency_versions": [],
  "expires_step": 0,
  "parent_version": "bound",
  "capsule_dependencies": []
}
